{
  "$schema": "https://json-schema.org/draft/2020-12/schema",
  "$id": "https://oh-my-pi.dev/schemas/herdr-delegator-config-v1.json",
  "title": "Herdr Delegator Configuration",
  "type": "object",
  "additionalProperties": false,
  "required": [
    "version",
    "storage"
  ],
  "properties": {
    "version": {
      "const": 1
    },
    "storage": {
      "type": "object",
      "additionalProperties": false,
      "required": [
        "root"
      ],
      "properties": {
        "root": {
          "type": "string",
          "pattern": "^/",
          "description": "Absolute deterministic run storage root. At least the user or project layer must configure it; a run layer may not change it."
        }
      }
    },
    "orchestrator": {
      "$ref": "#/$defs/orchestratorProfilePatch"
    },
    "worker_profiles": {
      "type": "object",
      "propertyNames": {
        "$ref": "#/$defs/profileName"
      },
      "additionalProperties": {
        "$ref": "#/$defs/workerProfilePatch"
      },
      "description": "Worker launch profiles, patched per layer by name. A profile inherits only from the same name in an earlier layer: a name no earlier layer defines must declare `role` in the layer that first defines it, or the layer is rejected with invalid_config. This cross-layer rule is enforced in code, not expressible here."
    },
    "skill_routing": {
      "$ref": "#/$defs/skillRouting"
    },
    "jev": {
      "$ref": "#/$defs/jev"
    }
  },
  "$defs": {
    "jev": {
      "type": "object",
      "additionalProperties": false,
      "description": "TypeSafe Jev (System One) settings. There is no on/off flag: Jev is how this plugin reads, and without a credential the tool errors clearly while the hooks pass the untouched result through. Every value below only tunes where reading is narrowed; none of them can drop a result.",
      "properties": {
        "model": {
          "type": "string",
          "description": "Model name sent with every request. Default jev-latest."
        },
        "read_threshold_lines": {
          "type": "integer",
          "minimum": 1,
          "description": "A read of a file with at least this many lines is narrowed to the ranked ranges. Default 200."
        },
        "read_view_lines": {
          "type": "integer",
          "minimum": 1,
          "description": "Line budget of a narrowed read view; ranges are added in probability order until it is spent. Default 120."
        },
        "output_min_lines": {
          "type": "integer",
          "minimum": 1,
          "description": "Tool output of at least this many lines is filtered to the ranked blocks, with what was withheld reported. Default 80."
        },
        "task_result_chars": {
          "type": "integer",
          "minimum": 1,
          "description": "Character cap applied to a subagent result before it enters the parent context; the rest stays in the artifact. Default 1200."
        },
        "hint_min_p": {
          "type": "number",
          "minimum": 0,
          "maximum": 1,
          "description": "Probability below which a judgment is reported as weak. It only chooses the one-line next action a judgment prints; it never removes a row. Default 0.6."
        },
        "moments": {
          "type": "array",
          "description": "Moments defined here rather than in code. A moment names when its state exists, what the state is read from, and the fixed questions asked about it.",
          "items": {
            "type": "object",
            "additionalProperties": false,
            "required": [
              "name",
              "when",
              "state",
              "questions"
            ],
            "properties": {
              "name": {
                "type": "string",
                "description": "Moment name, used as the calibration `stage` of every row it logs."
              },
              "when": {
                "type": "object",
                "additionalProperties": false,
                "description": "The event that carries the state: a tool result, a tool call, or a server response, optionally narrowed by path.",
                "properties": {
                  "tool_result": {
                    "type": "string",
                    "description": "Tool name whose result triggers the moment."
                  },
                  "tool_call": {
                    "type": "string",
                    "description": "Tool name whose call triggers the moment, before it runs."
                  },
                  "server": {
                    "type": "string",
                    "description": "Server action whose response triggers the moment, for example herdr_assignment.preflight."
                  },
                  "path": {
                    "type": "string",
                    "description": "Optional path or glob the trigger is restricted to."
                  }
                }
              },
              "state": {
                "type": "object",
                "additionalProperties": false,
                "description": "Where the judged state is read from.",
                "properties": {
                  "file": {
                    "type": "string",
                    "description": "One file whose text becomes the state."
                  },
                  "paths": {
                    "type": "array",
                    "items": {
                      "type": "string"
                    },
                    "description": "Several paths whose chunks become the state items, in path order."
                  }
                }
              },
              "questions": {
                "type": "object",
                "description": "Fixed questions by id, in the request format: each is a noul, choice, or score question whose instructions name its target by a backticked state path.",
                "additionalProperties": {
                  "type": "object"
                }
              }
            }
          }
        }
      }
    },
    "role": {
      "type": "string",
      "pattern": "^@[A-Za-z0-9][A-Za-z0-9._-]{0,63}$"
    },
    "thinking": {
      "enum": [
        "inherit",
        "off",
        "minimal",
        "low",
        "medium",
        "high",
        "xhigh",
        "max",
        "auto"
      ]
    },
    "profileName": {
      "type": "string",
      "pattern": "^[A-Za-z0-9][A-Za-z0-9._-]{0,63}$"
    },
    "skillName": {
      "type": "string",
      "pattern": "^[A-Za-z0-9][A-Za-z0-9._-]{0,63}$"
    },
    "guidanceText": {
      "type": "string",
      "minLength": 1,
      "maxLength": 500,
      "pattern": "^(?=.*\\S)[^\\u0000-\\u001f\\u007f]+$"
    },
    "orchestratorProfilePatch": {
      "type": "object",
      "additionalProperties": false,
      "properties": {
        "role": {
          "$ref": "#/$defs/role"
        },
        "thinking": {
          "$ref": "#/$defs/thinking"
        },
        "directive": {
          "$ref": "#/$defs/guidanceText",
          "description": "ORCH-facing execution guidance delivered inline with the orchestrator's first prompt, as the first advisory section (historical runs render it at the top of guidance.md or the generated role skill). Advisory only; never changes authority, scope, or completion conditions."
        }
      }
    },
    "workerProfilePatch": {
      "type": "object",
      "additionalProperties": false,
      "properties": {
        "role": {
          "$ref": "#/$defs/role"
        },
        "thinking": {
          "$ref": "#/$defs/thinking"
        },
        "guidance": {
          "$ref": "#/$defs/guidanceText",
          "description": "Legacy ORCH-facing profile-selection criteria for this worker profile; rendered only when intent is absent. Advisory only. Required nowhere; when a layer first defines a profile name it must still declare role (code-enforced)."
        },
        "intent": {
          "$ref": "#/$defs/guidanceText",
          "description": "ORCH-facing profile-selection criteria for this worker profile. Advisory only; never resolves a role, model, authority, or assignment contract."
        },
        "directive": {
          "$ref": "#/$defs/guidanceText",
          "description": "Worker-facing execution guidance delivered inline with the assignment prompt of a lane selected with this profile, and never to another profile. Advisory only; never changes the assignment contract, and never supplies a duty missing from the packaged worker skill."
        }
      }
    },
    "skillNames": {
      "type": "array",
      "minItems": 1,
      "maxItems": 8,
      "items": {
        "$ref": "#/$defs/skillName"
      }
    },
    "skillMetadata": {
      "type": "object",
      "additionalProperties": false,
      "properties": {
        "intent": {
          "$ref": "#/$defs/guidanceText",
          "description": "Optional advisory prose describing what this skill does wherever the skill is named."
        },
        "trigger": {
          "$ref": "#/$defs/guidanceText",
          "description": "Optional advisory prose describing when this skill applies; rendered only to the ORCH."
        }
      }
    },
    "agentRule": {
      "oneOf": [
        {
          "type": "object",
          "additionalProperties": false,
          "required": [
            "agent",
            "moment",
            "skills"
          ],
          "properties": {
            "agent": {
              "const": "orch"
            },
            "moment": {
              "enum": [
                "plan",
                "authoring",
                "settlement",
                "reset"
              ]
            },
            "skills": {
              "$ref": "#/$defs/skillNames"
            }
          }
        },
        {
          "type": "object",
          "additionalProperties": false,
          "required": [
            "agent",
            "moment",
            "skills"
          ],
          "properties": {
            "agent": {
              "allOf": [
                {
                  "$ref": "#/$defs/profileName"
                },
                {
                  "not": {
                    "const": "orch"
                  }
                }
              ]
            },
            "moment": {
              "enum": [
                "intake",
                "report"
              ]
            },
            "skills": {
              "$ref": "#/$defs/skillNames"
            }
          }
        }
      ]
    },
    "legacyRule": {
      "type": "object",
      "additionalProperties": false,
      "required": [
        "boundary",
        "surface",
        "skills"
      ],
      "properties": {
        "boundary": {
          "enum": [
            "plan",
            "authoring",
            "dispatch",
            "completion",
            "settlement",
            "reset"
          ]
        },
        "surface": {
          "enum": [
            "orch",
            "worker"
          ]
        },
        "skills": {
          "$ref": "#/$defs/skillNames"
        },
        "trigger": {
          "$ref": "#/$defs/guidanceText",
          "description": "Optional advisory prose naming when this legacy route applies."
        },
        "profiles": {
          "type": "array",
          "minItems": 1,
          "maxItems": 8,
          "items": {
            "$ref": "#/$defs/profileName"
          },
          "description": "Optional worker-profile scope. An undefined profile name is valid but never matches; orchestrator delivery points receive only unscoped rules."
        }
      }
    },
    "skillRouting": {
      "type": "object",
      "additionalProperties": false,
      "required": [
        "rules"
      ],
      "properties": {
        "rules": {
          "type": "array",
          "maxItems": 16,
          "items": {
            "oneOf": [
              {
                "$ref": "#/$defs/agentRule"
              },
              {
                "$ref": "#/$defs/legacyRule"
              }
            ]
          },
          "description": "Advisory routes in agent/moment or legacy boundary/surface form. Routes never gate settlement, lifecycle, or authority."
        },
        "skills": {
          "type": "object",
          "maxProperties": 64,
          "propertyNames": {
            "$ref": "#/$defs/skillName"
          },
          "additionalProperties": {
            "$ref": "#/$defs/skillMetadata"
          },
          "description": "Optional per-skill authored intent and trigger metadata; no installed-presence claim."
        }
      }
    }
  }
}
