{
  "version": 1,
  "storage": {
    "root": "/home/user/.local/share/herdr-delegator/runs"
  },
  "orchestrator": {
    "role": "@plan",
    "thinking": "high"
  },
  "worker_profiles": {
    "default": {
      "role": "@default",
      "thinking": "inherit",
      "guidance": "meticulous language work: documents, prose, review passes"
    },
    "task": {
      "role": "@task",
      "thinking": "inherit",
      "guidance": "code implementation under a clear specification"
    },
    "slow": {
      "role": "@slow",
      "thinking": "inherit",
      "guidance": "long deliberate reasoning; also the profile budget auditors run on"
    }
  },
  "jev": {
    "model": "jev-latest",
    "read_threshold_lines": 200,
    "read_view_lines": 120,
    "output_min_lines": 80,
    "task_result_chars": 1200,
    "hint_min_p": 0.6,
    "moments": [
      {
        "name": "release_notes",
        "when": {
          "tool_call": "edit",
          "path": "CHANGELOG.md"
        },
        "state": {
          "file": "CHANGELOG.md"
        },
        "questions": {
          "entry_observable": {
            "type": "noul",
            "instructions": "The topmost entry in `state.text` names a change a reader could verify in the repository, not an intention.",
            "criteria": {
              "true": "The entry names a tool, file, flag, or behavior that exists after the change.",
              "false": "The entry describes an intention, a refactor with no observable effect, or nothing specific."
            }
          }
        }
      }
    ]
  }
}
